{
  "$schema": "https://json-schema.org/draft/2020-12/schema",
  "$id": "https://cuexis.dev/schemas/cuexis.chart.v1.schema.json",
  "title": "Cuexis Canonical Chart v1",
  "type": "object",
  "additionalProperties": false,
  "required": [
    "format",
    "version",
    "chartId",
    "metadata",
    "timing",
    "templates",
    "behaviors",
    "objects",
    "requiredExtensions",
    "extensions"
  ],
  "properties": {
    "format": { "const": "cuexis.chart" },
    "version": { "const": 1 },
    "chartId": { "$ref": "#/$defs/uuidV7" },
    "metadata": { "type": "object" },
    "timing": { "$ref": "#/$defs/timing" },
    "camera": { "$ref": "#/$defs/camera" },
    "templates": {
      "type": "array",
      "maxItems": 10000,
      "items": { "$ref": "#/$defs/template" }
    },
    "behaviors": {
      "type": "array",
      "maxItems": 10000,
      "items": { "$ref": "#/$defs/behavior" }
    },
    "objects": {
      "type": "array",
      "maxItems": 100000,
      "items": { "$ref": "#/$defs/object" }
    },
    "requiredExtensions": {
      "type": "array",
      "maxItems": 256,
      "items": { "$ref": "#/$defs/requiredExtension" }
    },
    "extensions": { "type": "object" }
  },
  "$defs": {
    "uuidV7": {
      "type": "string",
      "pattern": "^[0-9a-f]{8}-[0-9a-f]{4}-7[0-9a-f]{3}-[89ab][0-9a-f]{3}-[0-9a-f]{12}$"
    },
    "chartEntityUuid": {
      "type": "string",
      "pattern": "^[0-9a-f]{8}-[0-9a-f]{4}-[57][0-9a-f]{3}-[89ab][0-9a-f]{3}-[0-9a-f]{12}$"
    },
    "finiteNumber": { "type": "number" },
    "vec3": {
      "type": "array",
      "minItems": 3,
      "maxItems": 3,
      "items": { "$ref": "#/$defs/finiteNumber" }
    },
    "quat": {
      "type": "array",
      "minItems": 4,
      "maxItems": 4,
      "items": { "$ref": "#/$defs/finiteNumber" }
    },
    "beat": {
      "type": "object",
      "additionalProperties": false,
      "required": ["numerator", "denominator"],
      "properties": {
        "numerator": { "type": "integer" },
        "denominator": { "type": "integer", "minimum": 1 }
      }
    },
    "timing": {
      "type": "object",
      "additionalProperties": false,
      "required": ["offsetMs", "defaultBpm", "bpmChanges", "stops"],
      "properties": {
        "offsetMs": { "$ref": "#/$defs/finiteNumber" },
        "defaultBpm": { "type": "number", "exclusiveMinimum": 0 },
        "bpmChanges": {
          "type": "array",
          "maxItems": 65536,
          "items": {
            "type": "object",
            "additionalProperties": false,
            "required": ["beat", "bpm"],
            "properties": {
              "beat": { "$ref": "#/$defs/beat" },
              "bpm": { "type": "number", "exclusiveMinimum": 0 }
            }
          }
        },
        "stops": {
          "type": "array",
          "maxItems": 65536,
          "items": {
            "type": "object",
            "additionalProperties": false,
            "required": ["beat", "durationMs"],
            "properties": {
              "beat": { "$ref": "#/$defs/beat" },
              "durationMs": { "type": "number", "exclusiveMinimum": 0 }
            }
          }
        }
      }
    },
    "camera": {
      "type": "object",
      "additionalProperties": false,
      "required": ["type", "fovY", "near", "far"],
      "properties": {
        "type": { "enum": ["perspective"] },
        "fovY": { "type": "number", "exclusiveMinimum": 0, "exclusiveMaximum": 179 },
        "near": { "type": "number", "exclusiveMinimum": 0 },
        "far": { "type": "number", "exclusiveMinimum": 0 },
        "pitch": { "type": "number" },
        "yaw": { "type": "number" },
        "roll": { "type": "number" },
        "defaultTransform": {
          "type": "object",
          "additionalProperties": false,
          "required": ["position"],
          "properties": {
            "position": { "$ref": "#/$defs/vec3" }
          }
        }
      }
    },
    "objectReference": {
      "type": "object",
      "additionalProperties": false,
      "required": ["domain", "id"],
      "properties": {
        "domain": { "const": "object" },
        "id": { "$ref": "#/$defs/chartEntityUuid" }
      }
    },
    "templateReference": {
      "type": "object",
      "additionalProperties": false,
      "required": ["domain", "id"],
      "properties": {
        "domain": { "const": "template" },
        "id": { "$ref": "#/$defs/chartEntityUuid" }
      }
    },
    "behaviorReference": {
      "type": "object",
      "additionalProperties": false,
      "required": ["domain", "id"],
      "properties": {
        "domain": { "const": "behavior" },
        "id": { "type": "string", "minLength": 1, "maxLength": 256 }
      }
    },
    "assetReference": {
      "type": "object",
      "additionalProperties": false,
      "required": ["domain", "id"],
      "properties": {
        "domain": { "const": "asset" },
        "id": { "type": "string", "pattern": "^[A-Za-z0-9][A-Za-z0-9._/-]{0,255}$" }
      }
    },
    "transformComponent": {
      "type": "object",
      "additionalProperties": false,
      "required": ["version", "position", "rotation", "scale"],
      "properties": {
        "version": { "const": 1 },
        "position": { "$ref": "#/$defs/vec3" },
        "rotation": { "$ref": "#/$defs/quat" },
        "scale": { "$ref": "#/$defs/vec3" }
      }
    },
    "renderableComponent": {
      "type": "object",
      "additionalProperties": false,
      "required": ["version", "mesh", "material"],
      "properties": {
        "version": { "const": 1 },
        "mesh": { "$ref": "#/$defs/assetReference" },
        "material": { "$ref": "#/$defs/assetReference" }
      }
    },
    "behaviorComponent": {
      "type": "object",
      "additionalProperties": false,
      "required": ["version", "behavior"],
      "properties": {
        "version": { "const": 1 },
        "behavior": { "$ref": "#/$defs/behaviorReference" }
      }
    },
    "noteComponent": {
      "type": "object",
      "additionalProperties": false,
      "required": ["version"],
      "properties": {
        "version": { "const": 1 },
        "beat": { "$ref": "#/$defs/beat" }
      }
    },
    "elementComponent": {
      "type": "object",
      "additionalProperties": false,
      "required": ["version"],
      "properties": { "version": { "const": 1 } }
    },
    "cameraComponent": {
      "type": "object",
      "additionalProperties": false,
      "required": ["version", "type", "fovY", "near", "far"],
      "properties": {
        "version": { "const": 1 },
        "type": { "enum": ["perspective"] },
        "fovY": { "$ref": "#/$defs/finiteNumber" },
        "near": { "type": "number", "exclusiveMinimum": 0 },
        "far": { "type": "number", "exclusiveMinimum": 0 }
      }
    },
    "components": {
      "type": "object",
      "minProperties": 1,
      "additionalProperties": false,
      "properties": {
        "cuexis.transform": { "$ref": "#/$defs/transformComponent" },
        "cuexis.renderable": { "$ref": "#/$defs/renderableComponent" },
        "cuexis.behavior": { "$ref": "#/$defs/behaviorComponent" },
        "cuexis.note": { "$ref": "#/$defs/noteComponent" },
        "cuexis.element": { "$ref": "#/$defs/elementComponent" },
        "cuexis.camera": { "$ref": "#/$defs/cameraComponent" }
      }
    },
    "patch": {
      "type": "object",
      "additionalProperties": false,
      "required": ["op", "path"],
      "properties": {
        "op": { "enum": ["add", "remove", "replace"] },
        "path": {
          "type": "string",
          "pattern": "^/components/(cuexis\\.(transform|renderable|behavior|note|element|camera))(/(position|rotation|scale|mesh|material|behavior|beat|fovY|near|far|type))?$"
        },
        "value": {}
      },
      "allOf": [
        {
          "if": { "properties": { "op": { "const": "remove" } } },
          "then": { "not": { "required": ["value"] } },
          "else": { "required": ["value"] }
        }
      ]
    },
    "template": {
      "type": "object",
      "additionalProperties": false,
      "required": ["id", "extends", "extensions"],
      "properties": {
        "id": { "$ref": "#/$defs/chartEntityUuid" },
        "name": { "type": ["string", "null"], "maxLength": 256 },
        "extends": {
          "oneOf": [
            { "type": "null" },
            { "$ref": "#/$defs/templateReference" }
          ]
        },
        "prototype": {
          "type": "object",
          "additionalProperties": false,
          "required": ["components"],
          "properties": { "components": { "$ref": "#/$defs/components" } }
        },
        "patch": {
          "type": "array",
          "maxItems": 256,
          "items": { "$ref": "#/$defs/patch" }
        },
        "extensions": { "type": "object" }
      },
      "oneOf": [
        {
          "properties": { "extends": { "type": "null" } },
          "required": ["prototype"],
          "not": { "required": ["patch"] }
        },
        {
          "properties": { "extends": { "$ref": "#/$defs/templateReference" } },
          "required": ["patch"],
          "not": { "required": ["prototype"] }
        }
      ]
    },
    "object": {
      "type": "object",
      "additionalProperties": false,
      "required": ["id", "parent", "extensions"],
      "properties": {
        "id": { "$ref": "#/$defs/chartEntityUuid" },
        "name": { "type": ["string", "null"], "maxLength": 256 },
        "parent": {
          "oneOf": [
            { "type": "null" },
            { "$ref": "#/$defs/objectReference" }
          ]
        },
        "components": { "$ref": "#/$defs/components" },
        "template": { "$ref": "#/$defs/templateReference" },
        "overrides": {
          "type": "array",
          "maxItems": 256,
          "items": { "$ref": "#/$defs/patch" }
        },
        "extensions": { "type": "object" }
      },
      "oneOf": [
        {
          "required": ["components"],
          "not": { "anyOf": [{ "required": ["template"] }, { "required": ["overrides"] }] }
        },
        {
          "required": ["template", "overrides"],
          "not": { "required": ["components"] }
        }
      ]
    },
    "behavior": {
      "type": "object",
      "additionalProperties": false,
      "required": ["id", "type", "version", "tracks"],
      "properties": {
        "id": { "type": "string", "minLength": 1, "maxLength": 256 },
        "type": { "const": "behavior.transform.keyframe" },
        "version": { "const": 1 },
        "tracks": { "type": "array", "maxItems": 6, "items": { "$ref": "#/$defs/behaviorTrack" } }
      }
    },
    "behaviorTrack": {
      "type": "object",
      "additionalProperties": false,
      "required": ["property", "keys"],
      "properties": {
        "property": {
          "enum": ["transform.position.x", "transform.position.y", "transform.position.z",
                   "transform.rotation", "transform.scale", "camera.fovY"]
        },
        "keys": {
          "type": "array",
          "minItems": 1,
          "maxItems": 65536,
          "items": { "$ref": "#/$defs/behaviorKey" }
        }
      }
    },
    "behaviorKey": {
      "type": "object",
      "additionalProperties": false,
      "required": ["beat", "value"],
      "properties": {
        "beat": { "$ref": "#/$defs/beat" },
        "value": {
          "oneOf": [
            { "$ref": "#/$defs/finiteNumber" },
            { "$ref": "#/$defs/vec3" },
            { "$ref": "#/$defs/quat" }
          ]
        },
        "easing": { "enum": ["linear", "in_cubic", "out_cubic", "in_out_cubic"] }
      }
    },
    "requiredExtension": {
      "type": "object",
      "additionalProperties": false,
      "required": ["id", "version"],
      "properties": {
        "id": { "type": "string", "pattern": "^[A-Za-z0-9][A-Za-z0-9._-]{0,255}$" },
        "version": { "type": "integer", "minimum": 1 }
      }
    }
  }
}
